{
  "schemaVersion": 1,
  "files": [
    "block.json",
    "shell.qml",
    "preview.json",
    "block-dependencies.json"
  ],
  "qmlModules": [
    {
      "uri": "Blannk.Design",
      "version": "1.0",
      "provider": "host"
    }
  ],
  "qmlImportPaths": [],
  "pythonPaths": [],
  "libraryPaths": [],
  "bundled": [],
  "dynamicAssets": []
}
